6,https://www.nytimes.com/2022/06/30/opinion/internet-speech-reform-facebook.html,Opinion | Resisting the Worst of the Web Is Not Futile - The New York Times,2022-06-30T20:01:05.219Z,By Kara Swisher,"Tech moguls may be more powerful ‚Äî and unholy ‚Äî than ever, but consumers don‚Äôt have to be complacent.","For my first column in The New York Times, nearly four years ago, I wrote about a topic I thought everyone desperately needed to hear at the time, using one of the world‚Äôs most important media platforms, pretty much because I knew it would make a lot more people pay attention. The gist: the increasing dangers from the amplification and weaponization of social media platforms by malevolent players and ‚Äî more important ‚Äî the sloppy management of these powerful systems by their creators, who hid behind flimsy excuses for their abrogation of responsibility. That all may seem obvious today, but it was anything but just a few short years ago. The fact that it‚Äôs arguably worse now is a sad bookend to my time with The Times. Central to my argument was showing how Facebook ‚Äî the company hiding in plain sight behind its new name, Meta ‚Äî was the most egregious perpetrator of this worrisome trend. Even then the huge company was still growing, so it was playing a key role in the metastasizing problem. Facebook was being used at the time to sway elections by some digital thugs. ‚ÄúWe face determined, well-funded adversaries who will never give up and are constantly changing tactics. It‚Äôs an arms race and we need to constantly improve too,‚Äù Facebook claimed. That gave me the perfect in, which I took and ran away with: The arms race metaphor is a good one, but not for the reasons Facebook intended. Here‚Äôs how I see it: Facebook, as well as Twitter and Google‚Äôs YouTube, have become the digital arms dealers of the modern age. All these companies began with a gauzy credo to change the world. But they have done that in ways they did not imagine ‚Äî by weaponizing pretty much everything that could be weaponized. They have mutated human communication, so that connecting people has too often become about pitting them against one another and turbocharged that discord to an unprecedented and damaging volume. They have weaponized social media. They have weaponized the First Amendment. They have weaponized civic discourse. And they have weaponized, most of all, politics. I thought what was happening and what would continue happening was obvious, but it caused a stir nonetheless; I was accused of being needlessly alarmist. The notion of social media‚Äôs toxicity seems almost quaint today, especially against the backdrop of the congressional hearings now underway detailing how the Jan. 6 attack on the Capitol unfolded. Most of the blame for that tragic event is the fault of men (we see you, Donald Trump) and women (thanks to emails and texts, you‚Äôre not invisible either, Ginni Thomas) acting egregiously and possibly illegally in real life. But there is also the matter of how much online communication tools have supplanted and turbocharged all others that came before them, like the telephone and the fax machine, to organize, to conspire and, mostly, to propagandize. It all feels like the TV show ‚ÄúScandal,‚Äù except even stupider, more dangerous and less believable ‚Äî yet here we are hearing daily tales of skulduggery that are profoundly damaging to democracy. No surprise, these tales contain a major toxic dollop of tech to help facilitate the ‚ÄúAmerican carnage‚Äù (not my phrase but Trump‚Äôs, and it works here). We are having trouble retrieving the article content. Please enable JavaScript in your browser settings. Thank you for your patience while we verify access. If you are in Reader mode please exit and log into your Times account, or subscribe for all of The Times. Thank you for your patience while we verify access. Already a subscriber? Log in. Want all of The Times? Subscribe.",Opinion,Not related to Blockchain
7,https://www.nytimes.com/2022/07/11/opinion/cryptocurrency-federal-reserve.html,Opinion | Crypto Is Crashing. Where Were the Regulators? - The New York Times,2022-07-11T23:00:07.000Z,By Paul Krugman,An anatomy materializes of a postmodern pyramid scheme.,"When the Federal Reserve speaks, it speaks in Fedspeak. A pithy turn of phrase or a striking metaphor can all too easily turn into a headline, causing big market moves and a public backlash. So dry technical language and euphemisms are usually the way to go. Given this reality, the bluntness of a recent speech on crypto regulation by Lael Brainard, the Fed vice chair, is almost shocking. True, Brainard didn‚Äôt go as far as Jim Chanos, the famous short-seller, who called crypto a ‚Äúpredatory junkyard.‚Äù But she came close. The very first heading in her remarks was, ‚ÄúDistinguishing Responsible Innovation From Regulatory Evasion,‚Äù and she strongly suggested that much of the crypto universe is driven by the latter. Traditional banking is regulated for a reason; crypto, in bypassing these regulations, she said, has created an environment subject to bank runs, not to mention ‚Äútheft, hacks and ransom attacks‚Äù ‚Äî plus ‚Äúmoney laundering and financing of terrorism.‚Äù Other than that, it‚Äôs all good. The thing is, most of Brainard‚Äôs litany has been obvious for some time to independent observers. So why are we only now hearing serious calls for regulation? Cryptocurrencies have been around since 2009, and in all this time they have never come to play a major role in real-world transactions ‚Äî El Salvador‚Äôs much-hyped attempt to make bitcoin its national currency has become a debacle. So how did cryptocurrencies come to be worth almost $3 trillion at their peak? (Two-thirds of that value has now vanished.) Why was nothing done to rein in ‚Äústablecoins,‚Äù which were supposedly pegged to the U.S. dollar but were clearly subject to all the risks of unregulated banking, and are now experiencing a cascading series of collapses reminiscent of the wave of bank failures that helped make the Great Depression great? We are having trouble retrieving the article content. Please enable JavaScript in your browser settings. Thank you for your patience while we verify access. If you are in Reader mode please exit and log into your Times account, or subscribe for all of The Times. Thank you for your patience while we verify access. Already a subscriber? Log in. Want all of The Times? Subscribe.",Opinion,Not related to Blockchain
8,https://www.nytimes.com/2022/07/28/opinion/cat-video-game.html,Opinion | What Is It Like to Be a Cat? - The New York Times,2022-07-28T19:36:06.000Z,By Jay Caspian Kang,Playing the hit video game ‚ÄúStray‚Äù made me think that hyperrealism is overhyped. ,"Video game marketing, as a rule, relies on the idea that some new frontier has been breached in our journey to completely separate our brains from the dull demands of our bodies. This is true for actually groundbreaking classic games like SimCity and Braid, but also applies to games that get rereleased year after year after year with minor tweaks. As a result, an industry that has had very few widespread advances in the past 20 years ends up talking about itself in almost revolutionary terms. This is Madden like you‚Äôve never seen it before! These are all lies ‚Äî I have played hundreds of hours of Madden and can report that there is no version of either that I have not seen before. I enjoy playing video games, but I play them like I drink coffee: regularly, with minimal discretion or taste, and even less stimulation. Most of the time I am just pressing buttons to see some little avatar of myself do something on the screen. For the past week, my wife, 5-year-old daughter and I have been playing Stray, which, as of this printing, is one of the best-reviewed games of the year. The sell is very simple: You are an orange cat. Not a cartoon cat that tells jokes and carries around guns, but just a regular cat who scratches couches, naps and jumps in boxes. There‚Äôs a very long and honestly somewhat flat story line that involves androids, an apocalypse and mutant rats, but none of that really matters. Stray is a hit, in large part, because gamers feel like this is what being a cat must really be like. It reminded me a bit of the 1988 French film ‚ÄúThe Bear,‚Äù which tried to show the life of two real bears who acted like bears and did not speak English or break out into song or whatever. The point is that you don‚Äôt need an anthropomorphized version of the animal ‚Äî this is the real thing. The ‚Äúrealness‚Äù of Stray is apparently so complete that it puts some real cats in an almost hypnotic trance as they watch the unnamed video game cat amble around a postapocalyptic landscape. (This did not happen to my 13-year-old cat, Bobbi, who, like most real cats, spends her days peeing on the bathroom floor next to her litter box, pooping in the garden and cannot be bothered to pose for videos.) I want to dwell for a moment on this idea of realism in video games because I‚Äôm not sure it‚Äôs a particularly worthwhile pursuit to just make games that almost perfectly mimic an actual thing. One of the most impressive and mind-bending games I‚Äôve played was called Braid, an independently produced 2008 title in which you control a little man in a blazer as he hops around a castle filled with puzzles. You solve these puzzles by manipulating time ‚Äî you have the power to rewind time but keep certain objects stuck in the present, which then changes the conditions of the game in a butterfly effect type of way. Braid changed the dimensions of gaming and proved you could exist in multiple realities at once. This effect was so disorienting and powerful that after playing the game for a few hours, I went downstairs to fix myself a sandwich and found that I could not perform the task without reminding myself the order in which one places the bread, the meat and the condiments. The developers of Stray and Braid certainly had different goals in mind when they made those respective titles, but I do think the difference between them underscores a lively and interesting debate about the artistic value of a video game. Realism and the idea that a video game should make you feel like you‚Äôre actually something, whether a cat or even Spiderman (a funny breakdown of the latter can be found here), has been a longstanding measure of quality in the industry. Games are judged on how closely their graphics adhere to real life and the ‚Äúimmersiveness‚Äù of their gameplay, which is oftentimes just another way of saying something like, ‚ÄúThis really felt like I was a cat.‚Äù These aren‚Äôt monolithic standards to be sure, but judging video games on how closely they adhere to reality seems similar to judging paintings solely through the school of photorealism. Is the final product impressive? Yes. Does it move me emotionally? No. We are having trouble retrieving the article content. Please enable JavaScript in your browser settings. Thank you for your patience while we verify access. If you are in Reader mode please exit and log into your Times account, or subscribe for all of The Times. Thank you for your patience while we verify access. Already a subscriber? Log in. Want all of The Times? Subscribe.",Opinion,Not related to Blockchain
9,https://www.nytimes.com/2022/09/30/opinion/ezra-klein-podcast-vitalik-buterin.html,Opinion | Ethereum‚Äôs Founder on What Crypto Can ‚Äî and Can‚Äôt ‚Äî Do - The New York Times,2022-09-30T09:00:09.000Z,By The Ezra Klein Show,Vitalik Buterin explains digital currency potential to transform our world.,"Produced by The Ezra Klein Show When most people hear about crypto,ù the first thing they think of is currencies.‚ Cryptocurrencies have skyrocketed in popularity over the past few years. And they‚ have given rise to an entire ecosystem of financial speculation, get rich quick schemes, and in some cases outright fraud. But there is another side of crypto that gets less attention: the segment of the community that is interested in the way the technology that powers crypto can decentralize decision making, make institutions more transparent and transform the way organizations are governed. That s the side I find far more interesting. There are few individuals as central to that latter segment of crypto as Vitalik Buterin. When he was still just a teenager, Buterin co-founded Ethereum, a decentralized platform whose token Ether is the second most valuable cryptocurrency today, surpassed only by Bitcoin. But the vision behind Ethereum was that the blockchain technology could be used for more than digital money; it could create a sort of digital infrastructure on top of which organizations and companies and applications could be built ostensibly free of centralizing structures like banks and governments. [You can listen to this episode of The Ezra Klein Show on Apple, Spotify, Amazon Music, Google or wherever you get your podcasts.] Over the last decade, Buterin has become arguably the core public intellectual on the nonfinancial side of crypto. His new book, Proof of Stake,ù is a collection of long, thoughtful essays that, taken together, lay out a vision of crypto as a truly transformative technology î one with the potential to revolutionize everything from city governance to voting systems to online identity. I myself have dueling impulses about Buterin s vision. On the one hand, I believe many of our governing systems and institutions are badly in need of the kind of reimagining he is engaged in. On the other hand, Im deeply skeptical of whether the issues Buterin and his ilk are focused on are actually technological problems that blockchains can solve. So this is a conversation that sits squarely within that tension. You can listen to our whole conversation by following The Ezra Klein Showù on Apple, Spotify, Google or wherever you get your podcasts. A list of book recommendations from our guests is here. (A full transcript of the episode is available here.) Image Credit...Ethan Pines ‚ÄúThe Ezra Klein Show‚Äù is produced by Annie Galvin and Rog Karma. Fact-checking by Michelle Harris, Mary Marge Locker and Kate Sinclair. Original music by Isaac Jones. Mixing by Sonia Herrero, Isaac Jones and Carole Sabouraud. Audience strategy by Shannon Busta. Special thanks to Kristin Lin, Kristina Samulewski, Will Wilkinson, Alex Tabarrok, Glen Weyl and Nathan Schneider.",Opinion,Related to Blockchain
10,https://www.nytimes.com/2022/11/21/opinion/business-economics/sam-bankman-fried-ftx-effective-altruism.html,Opinion | What Stage of Capitalism Is Sam Bankman-Fried? - The New York Times,2022-11-21T20:00:06.000Z,By David Wallace-Wells,"FTX‚Äôs $32 billion valuation was a fantasy, but nobody bothered to look at it closely.","How do you make a multibillion-dollar company disappear in a week? For Sam Bankman-Fried and his crypto exchange FTX, the simple answer is that a leaked balance sheet leads your biggest rival, himself under federal scrutiny, to instigate a sort of ‚Äúbank run‚Äù you cannot possibly cover, exposing billions of dollars in shortfalls you apparently created by riskily investing money that wasn‚Äôt yours. And revealing yourself, in the process, to be a very new kind of financial villain ‚Äî one who pitches not just the prospect of profit but also deliverance from the corrupt speculative system in which you ‚Äúmade‚Äù your ‚Äúbillions.‚Äù But if S.B.F. was just a meme stock ‚Äî his cultural capital inflated by our collective desire to see his profile grow ‚Äî what exactly was the meme? Cryptocurrency is little more than a decade old, and yet it has passed through several reputational phases: first, as the lawless province of black marketeers and hard-core libertarians obsessed with escaping government oversight; then as a speculative market in which many of those people made an astonishing and enviable amount of money; then as an investment sector for adventurous normies who might previously have turned to simple day-trading; then as an ‚Äúasset class‚Äù eyed by big-money investors and establishment banks. It was only at the start of last year‚Äôs N.F.L. season that Matt Damon, unknowingly standing on the precipice of a coming ‚Äúcrypto winter‚Äù in which the value of Bitcoin fell by two-thirds, endorsed Crypto.com and reminded millions of Americans that ‚Äúfortune favors the brave.‚Äù The gold-rush phase for cryptocurrency is over now ‚Äî with the FTX collapse punctuating that crypto winter, a Christmas of malfeasance. The death of FTX has been called crypto‚Äôs ‚ÄúLehman moment,‚Äù but it was not the first such collapse ‚Äî it follows the implosions of Celsius, Three Arrows Capital, Terra and Luna, among many others. But it‚Äôs fitting that Bankman-Fried will now always be remembered as this crypto crash‚Äôs central figure, because he postured as someone who could rewrite not just the rules of the financial system but its morality as well. To investors and legislators, he looked like the potential face of a new era for crypto, poised to legitimize through transparency and regulation what had always been an enormously shady, if often quite lucrative, sector. To progressives, he looked like our kind of oligarch, a sort of boy wonder who seemed capable of conjuring up world-changing billions guiltlessly, effectively out of thin air. And he had promised to give that magic internet money away just as quickly: to Democrats, for whom he was the second-largest donor in the midterm cycle and to whom he had casually promised as much as $1 billion by 2024; to pandemic-prevention policy work; to journalistic start-ups and a whole host of causes affiliated with ‚Äúeffective altruism,‚Äù a movement devoted to doing maximal good in the world. In just three years after its founding, FTX grew from zero to a $32 billion valuation and along the way seemed to provide every progressive millennial a potential sugar daddy. This was a fantasy, as anyone looking closely at the time could have told you. But it was very tempting to believe, and nobody was trying to look all that closely, it turns out ‚Äî not the editors who put him on the covers of Forbes and Fortune; not the traders who trusted him with billions in daily trading volume; not the recipients of his philanthropic pledges, many of which will now go unfulfilled; and most conspicuously, not the investors who handed him millions without seeming to even bother checking the books. We are having trouble retrieving the article content. Please enable JavaScript in your browser settings. Thank you for your patience while we verify access. If you are in Reader mode please exit and log into your Times account, or subscribe for all of The Times. Thank you for your patience while we verify access. Already a subscriber? Log in. Want all of The Times? Subscribe.",Opinion,Not related to Blockchain
1,https://www.nytimes.com/2021/05/20/opinion/cryptocurrency-bitcoin.html,Opinion | Technobabble  Libertarian Derp and Bitcoin - The New York Times,2021-05-20T23:00:06.000Z,By Paul Krugman,Rising asset prices don't mean that silly ideas make sense.,"A number of readers have asked me to weigh in on Bitcoin and other cryptocurrencies, whose fluctuations have dominated a lot of market news. Would I please comment on what it‚Äôs all about, and what‚Äôs going on? Well, I can tell you what it‚Äôs about. What‚Äôs going on is harder to explain. The story so far: Bitcoin, the first and biggest cryptocurrency, was introduced in 2009. It uses an encryption key, similar to those used in hard-to-break codes ‚Äî hence the ‚Äúcrypto‚Äù ‚Äî to establish chains of ownership in tokens that entitle their current holders to ‚Ä¶ well, ownership of those tokens. And nowadays we use Bitcoin to buy houses and cars, pay our bills, make business investments, and more. Oh, wait. We don‚Äôt do any of those things. Twelve years on, cryptocurrencies play almost no role in normal economic activity. Almost the only time we hear about them being used as a means of payment ‚Äî as opposed to speculative trading ‚Äî is in association with illegal activity, like money laundering or the Bitcoin ransom Colonial Pipeline paid to hackers who shut it down. Twelve years is an eon in information technology time. Venmo, which I can use to share restaurant bills, buy fresh fruit at sidewalk kiosks, and much more, was also introduced in 2009. Apple unveiled its first-generation iPad in 2010. Zoom came into use in 2012. By the time a technology gets as old as cryptocurrency, we expect it either to have become part of the fabric of everyday life or to have been given up as a nonstarter. If normal, law-abiding people don‚Äôt use cryptocurrency, it‚Äôs not for lack of effort on the part of crypto boosters. Many highly paid person-hours have been spent trying to find the killer app, the thing that will finally get the masses using Bitcoin, Ethereum or some other brand daily. But I‚Äôve been in numerous meetings with enthusiasts for cryptocurrency and/or blockchain, the concept that underlies it. In such meetings I and others always ask, as politely as we can: ‚ÄúWhat problem does this technology solve? What does it do that other, much cheaper and easier-to-use technologies can‚Äôt do just as well or better?‚Äù I still haven‚Äôt heard a clear answer. We are having trouble retrieving the article content. Please enable JavaScript in your browser settings. Thank you for your patience while we verify access. If you are in Reader mode please exit and log into your Times account, or subscribe for all of The Times. Thank you for your patience while we verify access. Already a subscriber? Log in. Want all of The Times? Subscribe.",Opinion,Not related to Blockchain
2,https://www.nytimes.com/2021/05/25/opinion/bitcoin-cryptocurrency.html,Opinion | Is the Bitcoin Craze Coming for Your 401(k)? - The New York Times,2021-05-25T22:30:03.000Z,By Spencer Bokat-Lindell,Cryptocurrencies have not quite delivered on their revolutionary promises. But they are messing with the stock market.,"This article is part of the Debatable newsletter. You can sign up here to receive it on Tuesdays and Thursdays. Cryptocurrencies have been around for 12 years now, and for much of that time, they were a fairly easy subcultural fixation to ignore, like SantaCon or the Golden Globes. But in 2021 that became a lot harder to do: Last week the combined value of cryptocurrencies plummeted after six months of breakneck growth, wiping out $1.3 trillion in wealth ‚Äî and causing the rest of the stock market to tumble with it. ‚ÄúAs the world of cryptocurrencies has exploded over the past year, so has its impact on actual companies and therefore financial markets,‚Äù The Times‚Äôs Matt Phillips wrote of the downturn. ‚ÄúAnalysts at JPMorgan recently noted that the market value of cryptocurrencies, as a share of the economy, are larger than the total outstanding amount of subprime real estate debt before the financial crisis.‚Äù Why have cryptocurrencies become so popular, and does their mainstreaming pose a threat to the broader economy? Here‚Äôs what people are saying. What‚Äôs the point of cryptocurrency? All money is, to some degree, an object of faith: A $100 bill is worth what $100 buys only because we believe it is and because that belief is underwritten by the U.S. government. What cryptocurrencies do, in effect, is take the state out of the equation: Instead of a bank, they rely on networks of powerful computers racing to verify transactions, a process that in turn generates more units ‚Äî or ‚Äúcoins‚Äù ‚Äî of currency. Every transaction is recorded through a cryptographic technology called blockchain, a kind of public ledger that is virtually impossible to alter. Bitcoin, the first and still by far the largest cryptocurrency, came online in 2009, and thousands more have since been created. We are having trouble retrieving the article content. Please enable JavaScript in your browser settings. Thank you for your patience while we verify access. If you are in Reader mode please exit and log into your Times account, or subscribe for all of The Times. Thank you for your patience while we verify access. Already a subscriber? Log in. Want all of The Times? Subscribe.",Opinion,Not related to Blockchain
