1,https://www.nytimes.com/2023/11/20/fashion/jewelry-diamond-origin-tracing-de-beers.html,Soon You May Know Exactly Where Your Diamond Was Mined - The New York Times,2023-11-20T10:12:14.000Z,By Victoria Gomelsky,"Several traceability systems have been introduced in the last six months, spurred by sanctions against Russian-mined stones.","Tracing the path of a diamond from the mine where it originated through the global supply chain is not as straightforward as it might seem ‚Äî especially for consumers who make an effort to know the source of their purchases, from coffee beans to clothing. The reasons include a longstanding industry practice of aggregating rough diamonds from different mines, the number of intermediaries involved in transforming a raw stone into a cut and polished gem, and the fragmented and global nature of the trade itself. An equally powerful reason may be that neither the jewelry industry nor consumers prioritized it. ‚ÄúEverything was sold based on size and quality; it was never sold based on origin,‚Äù said Susan Jacques, the president and chief executive of the Gemological Institute of America (G.I.A.), headquartered in Carlsbad, Calif. Now, primarily because of the war in Ukraine and the additional sanctions expected soon on diamonds from Russia (the world‚Äôs biggest diamond exporter by volume), ‚Äúknowing where a diamond has come from is becoming essential information,‚Äù Al Cook, the chief executive of the De Beers Group, told an audience at a jewelry trade show in June in Las Vegas. Image A De Beers diamond mine in South Africa.Credit...Mujahid Safodien/Agence France-Presse ‚Äî Getty Images Mr. Cook used the show to promote a blockchain platform that the mining giant hopes will become the industry‚Äôs new gold standard of traceability. Known as Tracr, the company, which uses high-speed photography to create a digital twin of a rough diamond, was founded in 2018. But Wesley Tucker, chief executive of Tracr, said that the complexity of creating a scalable solution that could be easily adopted by the entire industry, combined with pandemic-related delays, held up its rollout until now. We are having trouble retrieving the article content. Please enable JavaScript in your browser settings. Thank you for your patience while we verify access. If you are in Reader mode please exit and log into your Times account, or subscribe for all of The Times. Thank you for your patience while we verify access. Already a subscriber? Log in. Want all of The Times? Subscribe.",Fashion,Not related to Blockchain
2,https://www.nytimes.com/2024/04/08/fashion/bulgari-thinnest-watch.html,Bulgari Recaptures the Crown for the World‚Äôs Thinnest Watch - The New York Times,2024-04-08T14:09:49.000Z,By Robin Swithinbank,"The Octo Finissimo Ultra Mark II is 1.7 millimeters thick, half a tenth of a millimeter less than the previous record-holder.","Bulgari has its world record back. On Monday, the Italian luxury house with the Swiss fine watchmaking division reclaimed the record for the world‚Äôs thinnest mechanical wristwatch. The Octo Finissimo Ultra Mark II is 1.7 millimeters thick, 0.05 millimeters thinner than Richard Mille‚Äôs 1.75 millimeter RM UP-01 Ferrari, which two years ago snatched the record from Bulgari‚Äôs 1.8 millimeter Octo Finissimo Ultra. The difference? Half a tenth of a millimeter, approximately the thickness of a piece of office printer paper. ‚ÄúThis is sci-fi,‚Äù Antoine Pin, managing director of Bulgari‚Äôs watchmaking division, said of his record-breaker. ‚ÄúIt makes people excited and brings global attention to the segment. After all, people don‚Äôt come to Bulgari for the rational, and you don‚Äôt buy a mechanical watch for the perfection of the time-keeping process.‚Äù Image Bulgari‚Äôs 2024 Octo Finissimo Ultra Mark II. The race for the world‚Äôs thinnest mechanical watches has sped up in recent years. Establishment watchmakers such as Audemars Piguet, Jaeger-LeCoultre and Piaget quietly jostled for super-slim supremacy for decades, then, in 2014, Bulgari‚Äôs newly formed fine watchmaking division slid into the record books for the first time with its five-millimeter Octo Finissimo Tourbillon, then the world‚Äôs thinnest tourbillon (a record that Piaget was scheduled to rewrite Tuesday with the introduction of its 2-millimeter-thick Altiplano Ultimate Concept Tourbillon). We are having trouble retrieving the article content. Please enable JavaScript in your browser settings. Thank you for your patience while we verify access. If you are in Reader mode please exit and log into your Times account, or subscribe for all of The Times. Thank you for your patience while we verify access. Already a subscriber? Log in. Want all of The Times? Subscribe.",Fashion,Not related to Blockchain
3,https://www.nytimes.com/2024/04/09/fashion/hyt-watches-wonders-comeback.html,HYT Watches Aims for Another Comeback - The New York Times,2024-04-09T07:00:31.000Z,By Ming Liu,"After the brand‚Äôs roller-coaster decade, Vincent Perriard is now running the show ‚Äî and trying to calm the waters.","There will be all manner of watchmaking stories at the Watches and Wonders trade show this week ‚Äî from heritage and throwback narratives to female-led ones ‚Äî but HYT is hoping to add a comeback chapter. Known for its disruptive timekeeping technology that mixes liquid and mechanics, HYT ‚Äî for Hydro Mechanical Horologists ‚Äî burst onto the scene in 2012. Orders of more than 21 million Swiss francs, or $23.3 million, were quickly placed, but then came years of quality issues before a short-lived revival, followed by a bankruptcy in 2021. A second rebirth was equally brief, scuppered by a newly appointed chief executive who left after only 13 months. HYT‚Äôs current executive chairman, Vincent Perriard, who was its chief executive from 2011 to 2016, is now back running the show ‚Äî and trying to calm the waters. ‚ÄúTo be fully transparent, this company has been difficult from Day 1,‚Äù Mr. Perriard said at HYT‚Äôs headquarters in the Swiss watchmaking town of Neuch√¢tel. ‚ÄúBut there is a famous saying: ‚ÄòThere is no innovation and creativity without failure.‚Äô That‚Äôs really true. And that‚Äôs really us ‚Äî including a bankruptcy.‚Äù Mr. Perriard is spearheading what HYT is calling ‚Äúa new chapter,‚Äù which kicks off with the introduction of its T1 collection (the T stands for tradition), at the Watches and Wonders fair in Geneva. Followers of HYT will immediately notice the 45 millimeter size and streamlined octagonal case. The profile is considerably smaller than HYT‚Äôs signature 50 millimeter size, which was originally necessary to accommodate the liquid-based technology, Mr. Perriard explained. But it also has been the brand‚Äôs biggest bugbear. We are having trouble retrieving the article content. Please enable JavaScript in your browser settings. Thank you for your patience while we verify access. If you are in Reader mode please exit and log into your Times account, or subscribe for all of The Times. Thank you for your patience while we verify access. Already a subscriber? Log in. Want all of The Times? Subscribe.",Fashion,Not related to Blockchain
4,https://www.nytimes.com/2023/08/28/fashion/russia-diamond-sanctions.html,What Would More Sanctions on Russian Diamonds Really Do? - The New York Times,2023-08-28T09:12:12.000Z,By Elizabeth Paton,The Group of 7 and the European Union are expected to issue new rules in an effort to slow the flow of revenue into the Kremlin‚Äôs war chest.,"Eighteen months have passed since Russia invaded Ukraine, sending shock waves around the world ‚Äî and through the global diamond market. Russia is the world‚Äôs biggest diamond exporter by volume, with a state-owned company, Alrosa, mining almost one third of all diamonds produced in 2021. To prevent funds from flowing into the Kremlin war chest, the United States ‚Äî the world‚Äôs largest market for finished diamonds ‚Äî took action last spring when President Biden banned the import of rough diamonds from Russia and the U.S. Treasury Department placed sanctions on Alrosa. Other countries imposed sanctions of their own, including Britain, which early this year announced an outright ban on Russian diamonds. Last year the European Union had tried several times to enforce sanctions on Russian diamonds, but was prevented by Belgium because of protests from Antwerp, the Belgian port city that is a leading trade hub for precious stones. Its representatives have expressed concerns that, aside from the difficulty that comes with tracking a diamond‚Äôs true origin, sanctions could hand Antwerp‚Äôs rivals, like Dubai and India, a competitive advantage on the Russian diamond trade. Not everyone agreed. ‚ÄúThere are people for whom the diamonds sold in Antwerp are more important than the battle we are waging,‚Äù President Volodymyr Zelensky of Ukraine said last year. We are having trouble retrieving the article content. Please enable JavaScript in your browser settings. Thank you for your patience while we verify access. If you are in Reader mode please exit and log into your Times account, or subscribe for all of The Times. Thank you for your patience while we verify access. Already a subscriber? Log in. Want all of The Times? Subscribe.",Fashion,Not related to Blockchain
5,https://www.nytimes.com/2023/06/15/fashion/watches-artificial-intelligence.html,A.I. Lives in the Watch World‚Äôs Shadows - The New York Times,2023-06-15T09:12:14.193Z,By Victoria Gomelsky,"A few brands concede that they use chatbots to generate social media posts and mood boards, but for the most part their use remains ‚Äúin the shadows.‚Äù","GENEVA ‚Äî At IWC Schaffhausen‚Äôs booth at the Watches and Wonders fair in the convention center here this spring, Maurice Moitroux, IWC‚Äôs associate director of brand marketing, gestured toward a large, clunky, beige device sitting atop a counter near the entrance. ‚ÄúIt looks like a microwave, but it‚Äôs actually a computer,‚Äù he said. Intended to conjure the retro-futuristic vibe of IWC‚Äôs new Ingenieur watch collection ‚Äî an update to a 1976 model famously designed by Gerald Genta ‚Äî the vintage NCR monitor, dating to the 1980s, was one of several period artifacts displayed in and around the booth, including an experimental Mercedes-Benz C 111-III car from the 1970s. The computer, however, contained something unexpected: a ChatGPT 3.5-series module connected to a voice-activated application built to answer questions about Mr. Genta, who died in 2011, leaving behind a well-documented horological legacy. The display was an apt metaphor for the luxury watch industry‚Äôs current relationship with artificial intelligence. On the surface, A.I. is still something of a non-starter, with few brand executives being willing to discuss it publicly. (A group of tech industry leaders, however, recently signed an open letter warning of the existential threat it may pose to humanity.) Behind the scenes at big brands such as Cartier and Panerai, however, machine learning, a subset of A.I. that involves training machines to learn from data, is quietly revolutionizing how watches are made and brought to market. A handful of watchmakers have admitted to using ChatGPT to generate snappy social media copy and the A.I.-based design platform Midjourney to whip up wacky mood boards (as in, ‚ÄúWe want to do a shop and have it to look like it‚Äôs underwater in the Maldives,‚Äù George Bamford, a London-based watch customizer, said on a recent call). We are having trouble retrieving the article content. Please enable JavaScript in your browser settings. Thank you for your patience while we verify access. If you are in Reader mode please exit and log into your Times account, or subscribe for all of The Times. Thank you for your patience while we verify access. Already a subscriber? Log in. Want all of The Times? Subscribe.",Fashion,Not related to Blockchain
1,https://www.nytimes.com/2021/10/03/arts/music/dutch-national-opera-upload-review.html,Review: In ‚ÄòUpload ‚Äô Do Blockchains Dream of Electric Lizards? - The New York Times,2021-10-03T16:20:00.000Z,By Joshua Barone,Michel van der Aa‚Äôs new opera weaves technology into a traditional form with masterly restraint for a sci-fi spin on a fundamentally human tale.,"AMSTERDAM ‚Äî ‚ÄúI‚Äôm here, that‚Äôs for sure!‚Äù the digital facsimile of a father tells his daughter early in Michel van der Aa‚Äôs new opera, ‚ÄúUpload.‚Äù What exactly it means to be ‚Äúhere‚Äù ‚Äî particularly when someone exists only as consciousness stored on blockchain data spread across thousands of servers ‚Äî is up for debate, and guides the drama in ‚ÄúUpload,‚Äù a masterly weaving of music, film and motion-capture technology that opened at the Dutch National Opera here on Friday, ahead of a run at the Park Avenue Armory in New York next spring. But that sci-fi premise is little more than a veneer. Not for nothing did Mary Shelley give ‚ÄúFrankenstein‚Äù the subtitle ‚ÄúThe Modern Prometheus‚Äù; the finest genre fiction has always examined humanity through allegory. So, too, does van der Aa‚Äôs spare yet richly complicated work, which is preoccupied less with futuristic speculation than timeless matters of the heart and mind, whether corporeal or in the cloud. Which is not to say that van der Aa is uninterested in the bleeding edge. Rather, for decades, and with mixed success, he has been at the fore of marrying traditional forms with new media ‚Äî inventing software and putting his film degree to regular use ‚Äî through, for example, 3-D technology in the opera ‚ÄúSunken Garden‚Äù and virtual reality in the poetic installation ‚ÄúEight.‚Äù The challenge, always, is in making sure the shiny new thing doesn‚Äôt overtake the music, but instead is gracefully incorporated into a balanced whole. Van der Aa achieved something like that in ‚ÄúEight,‚Äù complementing the immersion of VR with a score of poplike directness. And ‚ÄúUpload‚Äù is the work of an artist in absolute command of his toolkit, employing a restraint that makes for smooth shifts between acoustic and electric, live performance and film, without any one thing drawing attention to itself throughout the opera‚Äôs brisk 80 minutes. We are having trouble retrieving the article content. Please enable JavaScript in your browser settings. Thank you for your patience while we verify access. If you are in Reader mode please exit and log into your Times account, or subscribe for all of The Times. Thank you for your patience while we verify access. Already a subscriber? Log in. Want all of The Times? Subscribe.",Arts,Not related to Blockchain
2,https://www.nytimes.com/2023/03/21/arts/design-nft-quantum-lawsuit-dismiss-mccoy.html,Judge Dismisses Lawsuit Over Ownership of $1.47 Million NFT - The New York Times,2023-03-21T18:33:29.000Z,By Zachary Small,The legal battle over ‚ÄúQuantum‚Äù is part of a larger effort to define rules of ownership for digital artworks.,"A federal court last Friday dismissed a lawsuit that questioned the ownership rules around an NFT called ‚ÄúQuantum,‚Äù which Sotheby‚Äôs sold for $1.47 million in 2021 as the first of its kind. The legal battle had become part of a larger effort to define rules of ownership for digital artworks. A Canadian company named Free Holdings brought the complaint last year against the auction house and the artist, Kevin McCoy, who created the artwork in 2014 as a demonstration of the blockchain‚Äôs potential to register artworks on a digital ledger system. The artwork itself looks like something from a science-fiction movie, as if it were an alien wormhole pulsing with neon colors. The dispute arose because the blockchain system that McCoy used for ‚ÄúQuantum‚Äù also required him to periodically renew his ownership rights. (Most web domains operate by similar rules.) But the artist neglected to renew terms of ownership, which allowed Free Holdings to purchase the registration and assert ownership over the work itself. The company subsequently accused Sotheby‚Äôs and McCoy of slander and commercial disparagement. James Cott, a magistrate judge for the U.S. District Court for the Southern District of New York, dismissed the case and wrote that Free Holdings had failed to establish its claims of ownership and injury. ‚ÄúFree Holdings has demonstrated nothing more than an attempt to exploit open questions of ownership in the still-developing NFT field to lay claim to the profits of a legitimate artist,‚Äù Judge Cott said in his dismissal. William Charron, an attorney representing McCoy, said in an email that he believed the judge‚Äôs decision would clear some confusion in the market. ‚ÄúThe significance of this case is that it prevented a party from using somewhat obscure blockchain usage rules to appropriate the work-product of an artist,‚Äù Charron explained. We are having trouble retrieving the article content. Please enable JavaScript in your browser settings. Thank you for your patience while we verify access. If you are in Reader mode please exit and log into your Times account, or subscribe for all of The Times. Thank you for your patience while we verify access. Already a subscriber? Log in. Want all of The Times? Subscribe.",Arts,Related to Blockchain
3,https://www.nytimes.com/2018/06/08/arts/art-financialization-blockchain.html,Art Is Becoming a Financial Product  and Blockchain Is Making It Happen - The New York Times,2018-06-08T12:32:06.000Z,By Scott Reyburn,Investors have shied away as an asset class. But new technology could make it a better bet.,"LONDON ‚Äî In recent years, there has been plenty of talk of the ‚Äúfinancialization‚Äù of art. As prices soar to new levels and digital technology opens new markets, that talk is getting louder. Last month in London, DACS, Britain‚Äôs leading artists‚Äô rights management organization, unveiled ‚ÄúThe Art Market 2.0‚Äù to lawmakers in the House of Commons. A report by academics at the Alan Turing Institute in London and Oxford University, it envisioned how blockchain technology might ‚Äúchange the balance of economic power in the art market‚Äù and ‚Äúintegrate art into the financial sector.‚Äù A financialized Art Market 2.0 would lead to an ‚Äúexplosion of liquidity and value,‚Äù according to the report. A day later at the London Business School‚Äôs 10th Art Investment Conference, held at Phillips auction house, there were, as usual, sessions discussing the performance of art as a financial asset class. This year, however, the event focused on whether ‚Äúnew technologies can make art a better investment.‚Äù Image Alain Servais, a Belgian collector and former investment banker, said he didn‚Äôt consider art an asset class. ‚ÄúThese are wealthy people‚Äôs toys,‚Äù he said.Credit...London Business School ‚ÄúIt‚Äôs not Wall Street,‚Äù Alain Servais, a Belgian collector, former investment banker and one of the speakers at the conference, said in an interview. ‚ÄúI don‚Äôt think art can be considered as an asset class.‚Äù He pointed to the art market‚Äôs lack of liquidity and regulation and to the ability of trade insiders to control the prices of certain highly collectible names. ‚ÄúThese are wealthy people‚Äôs toys,‚Äù he said. But to what extent has the art market been ‚Äúfinancialized,‚Äù in the way that a Wall Street investor would recognize? We are having trouble retrieving the article content. Please enable JavaScript in your browser settings. Thank you for your patience while we verify access. If you are in Reader mode please exit and log into your Times account, or subscribe for all of The Times. Thank you for your patience while we verify access. Already a subscriber? Log in. Want all of The Times? Subscribe.",Arts,Not related to Blockchain
4,https://www.nytimes.com/2022/03/23/arts/design/fairchain-artists-resale-royalties.html,Tech Start-Up Aims to Get Artists Royalties for Resale - The New York Times,2022-03-23T15:47:14.000Z,By Robin Pogrebin,"Fairchain generates digital contracts and certificates of title and authenticity, allowing artists to track their work and share in secondary market proceeds.","Even before the artist Robert Rauschenberg famously objected to seeing a 1958 painting he originally sold for $900 flip for $85,000 in 1973, artists have been frustrated by not receiving royalties for their work when it changes hands. Previous efforts to address this over the years have failed. But now, as musicians and other creative producers assert more control over their future sales and blockchain technology has allowed for easier tracking of intellectual property, two Stanford alumni have started a business to help visual artists reap the financial rewards when their work is resold privately or comes up for auction, in some cases at many multiples of the original price. ‚ÄúThere has been exponential growth in the secondary market, but artists have largely been left behind, even though they are essential to it,‚Äù Max Kendrick, one of the founders, said. ‚ÄúHow do we create a more sustainable model for the artist and the galleries that support them?‚Äù Charlie Jarvis, 24, a computer scientist, and Kendrick, 36, a former diplomat and a son of the sculptor Mel Kendrick, started the company, called Fairchain, in 2019. Little by little, it is gaining traction with artists and gallerists. ‚ÄúIf widely adopted, as it should be, it could be pretty revolutionary,‚Äù said the artist Hank Willis Thomas, an adviser to the company. ‚ÄúSo many artists who died poor spent their whole career giving away what they produced. ‚ÄúIn the music industry, it‚Äôs expected,‚Äù Thomas added. ‚ÄúI have friends on ‚ÄòLaw and Order‚Äô who, after 20 years, are still getting royalty checks. Outside of live performance we‚Äôre the only art form that doesn‚Äôt have some form of residuals.‚Äù We are having trouble retrieving the article content. Please enable JavaScript in your browser settings. Thank you for your patience while we verify access. If you are in Reader mode please exit and log into your Times account, or subscribe for all of The Times. Thank you for your patience while we verify access. Already a subscriber? Log in. Want all of The Times? Subscribe.",Arts,Related to Blockchain
5,https://www.nytimes.com/2022/02/12/arts/design/nft-collectors-artwork.html,After Pak and Beeple  What‚Äôs Next for NFT Collectors? Art Made With a Paintbrush - The New York Times,2022-02-12T10:00:22.000Z,By Zachary Small,"Now crypto collectors are investing in something more tangible, and traditional, like paintings and sculpture. And art dealers are rushing to woo them.","Felix Xu started his NFT art collection by purchasing a Chromie Squiggle, generated by an algorithm. Today, Xu, a 29-year-old Chinese tech executive, has more than 3,000 blockchain-based collectibles. But there is a hole burning in his crypto wallet that he would like to fill with real paintings. His budget stretches toward $500,000 and he is already on the wait-list for in-demand artists who use paint and moving brushes like Zhang Zipiao. So in December, Xu, a founder and chief executive of the start-ups Arpa and Bella Protocol, ventured through the gallery booths of Art Basel Miami Beach, where dealers from David Zwirner and Pace Gallery tried bending his ear toward the contemporary art market. He was looking for an education; they were looking for a sale. ‚ÄúI was really amazed with all the sculptures and paintings,‚Äù Xu said in an interview, crediting the fair with expanding his interest from blue-chip modernists like Picasso toward living artists like Nigel Cooke and Jessie Makinson. Xu is among the increasing number of NFT collectors looking to invest their cryptocurrency in something tangible: a traditional art collection, starting with the painting he bought in January by Renqian Yang, a Chinese artist living in New York. Critics have scoffed that a marriage between NFTs and the art world is impossible. But catering to the tastes of the crypto nouveau riche has become the frantic obsession of the commercial art world, which is reshaping itself around these new collectors nearly a year after artists like Beeple and Pak sold NFTs, or nonfungible tokens, for tens of millions of dollars, inspiring the typically technophobic art industry to head into the metaverse. Image A crypto collector, Pete D., purchased Le Corbusier‚Äôs ‚ÄúStill Life,‚Äù a handwoven wool tapestry from Aubusson, France.Credit...F.L.C./ADAGP, Paris and Artists Rights Society (ARS), NY; Boccara We are having trouble retrieving the article content. Please enable JavaScript in your browser settings. Thank you for your patience while we verify access. If you are in Reader mode please exit and log into your Times account, or subscribe for all of The Times. Thank you for your patience while we verify access. Already a subscriber? Log in. Want all of The Times? Subscribe.",Arts,Related to Blockchain
