1,https://www.nytimes.com/interactive/2023/08/25/business/shoptalk-fud-fear-uncertainty-doubt.html,Crypto Is Dead? Or Is That Just ‚ÄòFud‚Äô? - The New York Times,2023-08-25T09:03:27.000Z,By David Yaffe-Bellany,"The acronym, which stands for ‚Äúfear, uncertainty and doubt,‚Äù is used by crypto die-hards to dismiss any bad news about the industry, even when it is merited. ",Content not found,Business,Related to Blockchain
2,https://www.nytimes.com/explain/2022/cryptocurrency-guide/what-is-a-blockchain,New to the Crypto World? Here Are the Terms to Know. (Published 2022),2022-06-08T19:27:38.000Z,By The New York Times,null,"Cryptocurrencies have gone from a curiosity to a sizable force in finance, technology and culture, making them almost impossible to ignore. A range of players have embraced crypto, from individual speculators to major financial institutions, despite how volatile they are.. Some have generated vast riches, while others have destroyed huge amounts of wealth. When people talk about crypto, they may be referring to one of many different ideas and companies. The industry is booming and spawning an abundance of projects and new terms to go with them. The topic can be confusing, but the concept has also become ubiquitous. Learning the right terminology can help. Jump to: What is a Bitcoin? What is Bitcoin mining? What is a blockchain? What is Coinbase? What are cryptocurrencies? What is DeFi? What is an NFT? What is a stablecoin? What is web3? What is a Bitcoin? A Bitcoin is a digital token that can be sent electronically from one user to another, anywhere in the world. A Bitcoin can be divided out to eight decimal places, so you can send someone 0.00000001 Bitcoin. This smallest fraction of a Bitcoin ó the penny of the Bitcoin world ó is referred to as a Satoshi, named after the pseudonymous creator of Bitcoin. Bitcoin is also the name of the payment network on which this form of digital currency is stored and moved. Unlike traditional payment networks such as Visa, the Bitcoin network is not run by a single company or person. The system is run by a decentralized network of computers around the world that keep track of all Bitcoin transactions, similar to the way Wikipedia is maintained by a decentralized network of writers and editors. Bitcoin was introduced in 2008 by a creator who goes by the name Satoshi Nakamoto, who communicated with the rest of the world only by email and social messaging. While several people have been identified as possibly being Satoshi, the identity of the real Satoshi has not been confirmed. Satoshi created the original rules of the Bitcoin network and then shared the software with the rest of the world in 2009. The inventor largely disappeared from the public two years later. Once Satoshi had released the software, anyone could download and use it. This means Satoshi has no more control over the network now than anyone else. What is Bitcoin mining? Bitcoin mining refers to the process through which new Bitcoins are created and given to computers helping to maintain the network. The computers involved in Bitcoin mining are in a sort of computational race to process new transactions coming onto the network, solving complex math problems that require quintillions of numerical guesses per second. The winner of that race ó generally the person with the fastest computers ó gets a chunk of new Bitcoins. Since miners can earn rewards but are independent, this process is meant to incentivize participation and maintenance. There is generally a new winner about every 10 minutes, and this will continue until there are 21 million Bitcoins in the world. At that point, no new Bitcoins will be created. The network is expected to reach that cap in 2140. Every Bitcoin in existence was created through this method and initially given to a computer helping to maintain the records. In Bitcoinís early years, a crypto enthusiast could mine coins by running software on a laptop. But as the digital assets have become more popular, the amount of power necessary to win the race and generate Bitcoins has soared. A single Bitcoin transaction now requires more than 2,000 kilowatt-hours of electricity, or enough energy to sustain the average U.S. household for 73 days, according to some estimates. ADVERTISEMENT SKIP ADVERTISEMENT What is a blockchain? A blockchain is a database that is maintained communally and that reliably stores digital information. The original blockchain was the database on which all Bitcoin transactions were stored. It was named ìblockchainî because the transactions coming onto the network were grouped into blocks of data and then chained together using sophisticated math. After the Bitcoin blockchain had operated for a number of years, successfully storing every Bitcoin transaction and surviving numerous attacks from hackers, many programmers and entrepreneurs wondered if its design could be replicated to create other kinds of secure ledgers unrelated to Bitcoin. Companies and governments that donít rely on currency have since begun using blockchain technology to store their data. Banks are building blockchains that can track payments between accounts, while governments are experimenting with using blockchains to store property records and votes. What is Coinbase? Coinbase is a platform that allows people and companies to buy and sell various digital currencies, including Bitcoin, for a transaction fee. It is similar to a stock exchange. Founded in San Francisco in 2012, Coinbase allows people and companies to buy and sell various digital currencies, including Bitcoin. In April 2021, Coinbase became the first major cryptocurrency company to list its shares on a U.S. stock exchange. Coinbase set itself apart from other early blockchain businesses by becoming one of the first to get a new special license, called the BitLicense, to run a virtual currency company in New York. In addition to providing the brokerage service for small investors, Coinbase also runs an exchange called GDAX, which is tailored to larger investors. What are cryptocurrencies? ìCryptocurrenciesî is a term referring to the various virtual currencies that have been developed since Bitcoin was created. The most well-known cryptocurrencies are Ether, Dogecoin and Tether. Ether is the virtual currency used on the global computing network Ethereum, which operates according to rules defined by Ethereum software. Those rules allow the Ethereum network to be programmed to complete certain types of computing tasks, with every computer on the network completing the tasks simultaneously to ensure they are done correctly. Generally, the tasks involve money. The creator of Ethereum, Vitalik Buterin, has likened the network to a global smartphone that can be programmed to operate according to the apps built on top of it. The apps are called Dapps because they are run by a decentralized network of computers. Mr. Buterin was inspired by Bitcoinís success to create Ethereum. But he set out to build something that could do more than Bitcoin: He wanted to build a system that would make it possible to program more complex financial transactions. With Ethereum, two companies can conduct transactions, such as settling a stock option on a shared computer, that allows them both to check the records. Dogecoin was created as a parody of cryptocurrency in 2013 by two friends who had met in a chat room. Named after a meme of an expressive dog, Dogecoin was meant to mock the self-serious cryptocurrencies of the time, many of which never took off. The joke did, though, and it spawned a community of enthusiasts who have kept it alive for years. Tether is the largest stablecoin, a type of cryptocurrency that is typically pegged to an existing government-backed currency. It is roughly half-invested in a type of short-term corporate debt called commercial paper. Show more ADVERTISEMENT SKIP ADVERTISEMENT What is DeFi? Decentralized Finance, or DeFi, refers to the universe of alternative financial services spawned by the development of cryptocurrencies. DeFi is an umbrella term for the part of the crypto universe that is geared toward building a new, internet-native financial system, using blockchains to replace traditional intermediaries like banks and trust mechanisms. It has allowed crypto businesses to move into more traditional banking territory, offering services such as lending and borrowing. Investors can earn interest on their holdings of digital currencies ó often a lot more than they could on cash deposits in a bank ó or borrow with crypto as collateral to back a loan. Crypto loans generally involve no credit checks since transactions are backed by digital assets. To send or receive money in the traditional financial system, you need intermediaries like banks or stock exchanges. In DeFi, those middlemen are replaced by software. As people trade directly with one another, blockchain-based ìsmart contractsî do the work of making markets, settling trades and ensuring that the entire process is fair and trustworthy. What is an NFT? A nonfungible token, or NFT, is a digital asset that establishes authenticity and ownership and can be verified on a blockchain network. An NFT is basically a way to claim ownership of a digital file: You can think of it as a certificate of authenticity you might get if you buy an expensive sculpture. The sculpture can be copied, forged or even stolen, but because you have the certificate of authenticity, you can theoretically prove that you are the owner of the original. NFTs make digital artworks unique and, therefore, sellable. Artists, musicians, influencers and sports franchises can use them to monetize digital goods that were previously cheap or free. The technology also responds to the art worldís need for authentication and provenance in an increasingly digital world, permanently linking a digital file to its creator. The technology for NFTs has been around since the mid-2010s but became mainstream in late 2017 with CryptoKitties, a site that allowed people to buy and ìbreedî limited-edition digital cats with cryptocurrency. Since then, investors have begun buying and trading NFTs, often for eye-popping prices. What is a stablecoin? A stablecoin is a type of cryptocurrency that is typically pegged to a stable asset, like the dollar or another government-backed currency. To promise holders that every $1 they put in will remain worth $1, stablecoin issuers hold a bundle of assets in reserve, usually short-term securities such as cash, government debt or commercial paper. Stablecoins are useful because they help lock in value at the time of transaction. This is important since cryptocurrencies are volatile and prone to price fluctuations. They form a bridge between traditional money and crypto, and are exploding in popularity as a practical and cheap way to make transactions in cryptocurrency. But many stablecoins are built more like slightly risky investments than like the dollars-and-cents cash they claim to be. And, so far, they are slipping through regulatory cracks. Regulators are concerned about stablecoins because they have exploded in popularity very quickly, and because many are backed by traditional reserves, they could and trigger a kind of bank run that would potentially pose risks in the wider financial system. There is also no consistent oversight of issuers or a standard for reserves, and as such different stablecoin issuers have different types of reserve backing, including more or less cash, treasuries, commercial paper, etc. There are a few kinds of stablecoins, including these digital assets backed by traditional reserves, others are collateralized by crypto and, finally, algorithmic stablecoins. The risk in algorithmic stablecoins ó which depend on a mathematical formula devised by issuers and investor interest to maintain stability ó was demonstrated in May when Terra/Luna crashed after the assumptions the algorithm was premised on did not pan out in the market and investors fled. ADVERTISEMENT SKIP ADVERTISEMENT What is web3? ìWeb3î is a term some technologists use to describe the idea of a new version of the web made up of blockchain-based platforms and services fueled by cryptocurrency. At its core, web3 aims to replace centralized corporate platforms with open protocols and decentralized, community-run networks. The term has been around for years, but it has become trendy in the past year or so. Packy McCormick, an investor who helped popularize web3, has defined it as ìthe internet owned by the builders and users, orchestrated with tokens.î Web3 is seen as the next evolution of web1 (the era in the 1990s and early 2000s during which the internet was made up of blogs, message boards and early portals like AOL and CompuServe) and web2 (a phase starting around 2005 or so, characterized by social media behemoths like Facebook, Twitter and YouTube). Proponents envision that web3 will take many forms, including decentralized social networks, ìplay-to-earnî video games that reward players with crypto tokens, and NFT platforms that allow people to buy and sell pieces of digital culture. The more idealistic ones say web3 will transform the internet as we know it, upending traditional gatekeepers and ushering in a new, middleman-free digital economy. But some critics believe that web3 is little more than a rebranding effort for crypto, with the aim of shedding cryptoís reputation as a place for rogues and rebels and convincing people that blockchains are the next phase of computing. Others believe itís a dystopian vision of a pay-to-play internet in which every activity and social interaction becomes a financial instrument to be bought and sold.",Explain,Related to Blockchain
3,https://www.nytimes.com/2024/03/13/opinion/internet-web-3-tech.html,Opinion | Yes  the Internet Is Broken  but What Does a Fix Look Like? - The New York Times,2024-03-13T19:00:04.000Z,By Peter Coy,"There is no obvious way to reclaim control over the web from Big Tech, but technologists are trying.","Tuesday was the 35th anniversary of the day that Tim Berners-Lee of the European Organization for Nuclear Research wrote the memo proposing what became the World Wide Web. Queen Elizabeth II knighted him in 2004 for his achievement. I think it‚Äôs fair to say, though, that most people are not in the mood to celebrate what has become of Sir Timothy‚Äôs invention. It‚Äôs common to hear that the internet is broken and that social media is a dumpster fire. Recent case in point: On Wednesday the House voted to force the Chinese owners of TikTok to sell it, or be banned from the United States, on the grounds that it has become a channel for what the House majority leader called Chinese ‚Äúdata collection and propaganda.‚Äù Technology types are working on cures for what ails the internet, and their cures are, no surprise, technological. I‚Äôve been reading up on some of them. A lot go in the right direction, but I haven‚Äôt seen anything that seems likely to fully solve the many problems of today‚Äôs internet, from invasions of privacy to incitements of violence. That‚Äôs a tall order. Fortunately, a lot of smart people are taking the issues seriously. Lasting solutions, if there are any, are likely to come from a combination of technological, legal and cultural approaches. Back to the nerds: On Tuesday Berners-Lee published an open letter on Medium that said the web was intended ‚Äúto be a tool to empower humanity‚Äù that ‚Äúwas decentralized with a long tail of content and options.‚Äù In the past decade, though, he wrote, ‚Äúinstead of embodying these values, the web has instead played a part in eroding them.‚Äù Berners-Lee is developing and proselytizing for a new system that gives each person his or her own personal online-only data store, or POD for short. The PODs let people decide how their data is managed, used and shared. The Flanders region of Belgium has already authorized PODs for all of its citizens, Berners-Lee wrote. He co-founded a company, Inrupt, that‚Äôs built on the concept of PODs and the computer servers associated with them. We are having trouble retrieving the article content. Please enable JavaScript in your browser settings. Thank you for your patience while we verify access. If you are in Reader mode please exit and log into your Times account, or subscribe for all of The Times. Thank you for your patience while we verify access. Already a subscriber? Log in. Want all of The Times? Subscribe.",Opinion,Related to Blockchain
4,https://www.nytimes.com/2022/12/01/opinion/blockchains-what-are-they-good-for.html,Opinion | Blockchains  What Are They Good For? - The New York Times,2022-12-02T00:00:09.000Z,By Paul Krugman,Growing evidence says: absolutely nothing. ,"A year ago Bitcoin and other cryptocurrencies were selling at record prices, with a combined market value of around $3 trillion; glossy ads featuring celebrities ‚Äî most infamously Matt Damon‚Äôs ‚ÄúFortune Favors the Brave‚Äù ‚Äî filled the airwaves. Politicians, including, alas, the mayor of New York, raced to align themselves with what seemed to be the coming thing. Skeptics like yours truly were told that we just didn‚Äôt get it. Since then the prices of crypto assets have plunged, while a growing number of crypto institutions have collapsed amid allegations of scandal. The implosion of FTX, which appears to have used depositors‚Äô money in an attempt to prop up a related trading firm, has made the most headlines, but it‚Äôs only one entry on a growing list. We are, many people say, going through a ‚Äúcrypto winter.‚Äù But that may understate the case. This is looking more and more like Fimbulwinter, the endless winter that, in Norse mythology, precedes the end of the world ‚Äî in this case the crypto world, not just cryptocurrencies but the whole idea of organizing economic life around the famous ‚Äúblockchain.‚Äù And the real question, it seems to me, is why so many people ‚Äî not just na√Øve small investors, but also major financial and business players ‚Äî bought into the belief that this bad idea was the wave of the future. A blockchain is a digital ledger associated with an asset, recording the history of transactions in that asset ‚Äî who bought it from whom and so on. The asset could be a digital token like a Bitcoin, but it could also be a stock or even a physical thing like a shipping container. Ledgers, of course, are nothing new. What‚Äôs distinctive about blockchains is that the ledgers are supposed to be decentralized: They aren‚Äôt sitting on the computers of a single bank or other company; they‚Äôre in the public domain, sustained by protocols that induce many people to maintain records on many servers. These protocols are, everyone tells me, extremely clever. I‚Äôll take their word for it. The question I‚Äôve never heard or seen satisfactorily answered, however, is, ‚ÄúWhat‚Äôs the point?‚Äù Why go to the trouble and expense of maintaining a ledger in many places, and basically carrying that ledger around every time a transaction takes place? We are having trouble retrieving the article content. Please enable JavaScript in your browser settings. Thank you for your patience while we verify access. If you are in Reader mode please exit and log into your Times account, or subscribe for all of The Times. Thank you for your patience while we verify access. Already a subscriber? Log in. Want all of The Times? Subscribe.",Opinion,Related to Blockchain
5,https://www.nytimes.com/2022/01/24/opinion/crypto-blockchain-nfts.html,Opinion | The Strange Allure of the Blockchain - The New York Times,2022-01-24T20:35:01.000Z,By Tressie McMillan Cottom,Why the appeal of cryptocurrencies and NFTs crosses borders of class and race.,"My family managed to get together for a small Thanksgiving dinner last year. It was our first gathering since April 2020. After a big meal, my cousin only wanted to talk about one thing: cryptocurrency. He is a middle-aged Black man from New York, just a few years older than I am, but those years make a huge difference in his job security. When he came of age, he got a blue-collar job working for the city. He has worked at that job since he was 17 years old, so he will be able to retire as a relatively young man. And since the job is unionized, my cousin will retire with a pension and health benefits ‚Äî the kind of pathway to economic security that is becoming increasingly rare. These days, ours is an information economy that likes credentials, which involves going to some kind of postsecondary school. Even with high wages for skilled trades, like the one my cousin used to get that union job straight after high school, blue-collar trades are a hard sell to young workers. My cousin is not exactly a dinosaur, but he is not the kind of guy you imagine day-trading or actively managing an investment portfolio. Yet he is absolutely enthused about Bitcoin. While he is figuring out his second act, he views crypto as the way to build ‚Äúgenerational wealth‚Äù and ‚Äúfreedom.‚Äù I put those words in quotes because you hear them a lot in conversations around financial-sector schemes, and I am not sure they mean anything in those contexts. This week, the New York mayor, Eric Adams, is living up to his campaign promise to get his first three paychecks converted to cryptocurrency. My blue-collar cousin has a lot in common with his mayor. The allure of the next American frontier crosses all kinds of lines, including class lines. I‚Äôll get to that in a second. Bitcoin is the most well-known cryptocurrency, but there are many others, like Ethereum, Dogecoin, and Tether, which come up a lot among my peers. Some people talk about crypto as being revolutionary because it promises to democratize access to financial markets and give individual investors control of their destiny. In an adjacent space, nonfungible tokens ‚Äî or NFTs ‚Äî promise something similar. NFTs are like coupons that represent an underlying object, like a piece of artwork, although they could represent almost anything. For my part, the discussion over Thanksgiving leftovers brought home a data point about women‚Äôs and people of color‚Äôs interest in cryptocurrency. A 2021 survey found that the people who trade crypto are a far cry from the young, white, male image of a techbro: The average cryptocurrency trader is under 40 (mean age is 38) and does not have a college degree (55 percent). Two-fifths of crypto traders are not white (44 percent), and 41 percent are women. That survey captured a lot of people, like my cousin. What fascinates me is how widely crypto and NFT talk has diffused, and so quickly. It is not often that I hear the same branding from lower-income people of color that I also hear from high-earning white peers with advanced degrees. Depending on your consumer profile ‚Äî biographical data like your age, race and gender, plus your purchasing habits ‚Äî you probably hear about these financial instruments from online ads, social media groups, and peers who are early adopters. I hear about crypto from my educated, high-income academic and writing friends who also shop at Target a lot. I also hear about crypto from financial advisers and college classmates who share stories about making a lot of money mining crypto and trading NFTs. But because of my racial and geographic identities, I also hear about crypto from my working-class friends and family. They are getting messages about crypto from Facebook and Instagram and their friends who have moved on from candle-leggings-timeshare-jewelry multilevel marketing schemes to trading Dogecoin. Crypto and NFTs might be the only thing these diverse groups share in common. For that reason alone, the explosion of these technologies deserves some sociological attention. We are having trouble retrieving the article content. Please enable JavaScript in your browser settings. Thank you for your patience while we verify access. If you are in Reader mode please exit and log into your Times account, or subscribe for all of The Times. Thank you for your patience while we verify access. Already a subscriber? Log in. Want all of The Times? Subscribe.",Opinion,Related to Blockchain
