4,https://www.nytimes.com/2019/08/29/arts/design/mika-rottenberg-review-new-museum.html,Mika Rottenberg‚Äôs ‚ÄòEasypieces‚Äô Transports You to Parts Unknown - The New York Times,2019-08-29T09:00:16.000Z,By Martha Schwendener,"The artist‚Äôs new video installation focuses on the strange and sometimes alluring: Siberia, with its warbling throat singers, as well as a potato farm in Maine and the phenomenon known as A.S.M.R.","Rustling paper, the crackle of frying food, a whispering voice, beads rubbing together: These are some of the sounds that can induce the brain-tingling sensation known as autonomous sensory meridian response, or A.S.M.R. These kinds of noises are also ubiquitous in the strange and alluring recent videos in Mika Rottenberg‚Äôs ‚ÄúEasypieces,‚Äù which takes its title from Richard P. Feynman‚Äôs book ‚ÄúSix Easy Pieces‚Äù (1994): his introduction to the fundamentals of physics for general audiences. The centerpiece of this show at the New Museum, which was curated by Margot Norton, is ‚ÄúSpaghetti Blockchain‚Äù (2019), a 21-minute video that ricochets among warbling Tuvan throat singers in Siberia, the CERN antimatter factory in Switzerland, a potato farm in Maine and an imaginary manufacturer of A.S.M.R. products. In addition to bright colors and bristling, popping and whirring sounds, the video also relies on classically Surrealist, dreamlike scenarios. The idea of matter, and the relationship between animate and inanimate objects, purports to be at its core, although this is a bit lost in the A.S.M.R. sensorium and the excess of sound and color that has come to characterize Ms. Rottenberg‚Äôs work. Video A clip from Mika Rottenberg s ‚ÄúSpaghetti Blockchain,‚Äù 2019. Video via Mika Rottenberg and Hauser & WirthCreditCredit... Another video here, ‚ÄúNoNoseKnows (Artist Variant),‚Äù from 2012, features the 6-foot-4 fetish performer who calls herself Bunny Glamazon, sitting in a windowless room above a Chinese pearl factory, smelling bouquets of flowers until her eyes water and her nose grows to Pinocchio-like proportions. Here again, absurd actions and juxtapositions reign, reminding you of the famous statement by the French writer Isidore Ducasse, better known as the Comte de Lautr√©amont, which was adopted by the Surrealists: ‚ÄúBeautiful as the accidental encounter, on a dissecting table, of a sewing machine and an umbrella.‚Äù The much shorter video ‚ÄúSneeze‚Äù (2012) depicts men in business suits sneezing out rabbits or hunks of meat, while ‚ÄúCosmic Generator (Tunnel Variant),‚Äù from 2017, pivots on another unlikely pairing: a Chinese restaurant in the Mexican city of Mexicali and a wholesale market in Yiwu, China. Amped-up sensory details and oddities, like the colorful objects crammed into the market, shape the core of this video. Image The show includes ‚ÄúNoNoseKnows (Artist Variant),‚Äù 2015, a single-channel video installation.Credit...Mika Rottenberg and Hauser & Wirth We are having trouble retrieving the article content. Please enable JavaScript in your browser settings. Thank you for your patience while we verify access. If you are in Reader mode please exit and log into your Times account, or subscribe for all of The Times. Thank you for your patience while we verify access. Already a subscriber? Log in. Want all of The Times? Subscribe.",Arts,Not related to Blockchain
5,https://www.nytimes.com/2018/01/13/arts/cryptocurrency-art-market.html,Will Cryptocurrencies Be the Art Market‚Äôs Next Big Thing? - The New York Times,2018-01-13T11:28:21.000Z,By Scott Reyburn,Digital collectibles underpinned by blockchain technology are rising and falling in value at a far faster rate than just about everything in the analogue art world.,"LONDON ‚Äî There‚Äôs a new gold rush. But this precious metal doesn‚Äôt actually exist. The frenzy is for so-called cryptocurrencies ‚Äî or encrypted digital money ‚Äî and their value skyrocketed in 2017. The price of Bitcoin, the pioneer decentralized virtual currency, rose more than 1,300 percent last year, despite plunging 40 percent at one point in December. A Bitcoin rival, Ether, was up 8,000 percent. It is thought that the total worldwide value of cryptocurrencies could reach $1 trillion this year. Bitcoin and its derivatives have, for the moment, proved too volatile and unwieldy for day-to-day transactions. Yet the cryptocurrency model, underpinned by decentralized blockchain ledger technology, is increasingly becoming a force in more specialized areas of the economy. The art world is one of them. On Dec. 16, the nascent market for what might be called cryptoart appeared to reach a new level when the hitherto-unknown Distributed Gallery announced the auction of ‚ÄúReady Made Token,‚Äù a unique unit of a cryptocurrency that the gallery said was created by Richard Prince using technology from Ethereum, the network responsible for Ether. The online gallery describes itself as the first to specialize in ‚Äúblockchain-based artwork and exhibition.‚Äù It invited bids for the work, starting at one Ether, equivalent to about $650 at the time. (As of Friday, one Ether was worth about $1,200, according to ethereumprice.org.) The timed auction ends on Monday. The appearance of a crypto ‚Äúready-made‚Äù by an artist of Mr. Prince‚Äôs stature seemed to suddenly put blockchain on the art world map. Distributed Gallery even arranged for Mr. Prince to attend the inaugural Rare Digital Art Festival in New York on Saturday. But when buying into the world of cryptocurrencies, it can be difficult to determine what is real. Consider this Twitter post from Mr. Prince on Jan. 6: We are having trouble retrieving the article content. Please enable JavaScript in your browser settings. Thank you for your patience while we verify access. If you are in Reader mode please exit and log into your Times account, or subscribe for all of The Times. Thank you for your patience while we verify access. Already a subscriber? Log in. Want all of The Times? Subscribe.",Arts,Not related to Blockchain
6,https://www.nytimes.com/2017/12/30/arts/10-of-our-best-weekend-reads-one-great-video.html,10 of Our Best Weekend Reads + One Great Video - The New York Times,2017-12-30T10:30:15.000Z,By Kaly Soto,"The magazine looks back at artists, innovators and thinkers we lost this year. Styles offers a lesson in cryptokitties (I had to Google it, too). And Metropolitan offers lessons in happiness from those who have lots of experience.","This weekend is one for reflecting and looking ahead; for family, friends and football; for sleeping in and starting things off right; for bundling up and bingeing on good (or bad) TV. Whatever you‚Äôre doing, take a minute, or a bit more, and indulge in some great journalism. Happy New Year! Image Credit...John Pilson for The New York Times The lives they lived The magazine embarks on its annual remembrance of some of the artists, innovators and thinkers we lost in the past year. The collection includes essays on Mary Tyler Moore, Chuck Berry, Dick Gregory and Sam Shepard (whose hat is pictured above). Magazine _____ Image Credit...Photo Illustration by Stephanie Gonot for The New York Times 10 cultural battles that ruled 2017 Trump versus Hollywood. Echoes of the Confederacy. Taylor Swift and the alt-right. Here‚Äôs a not-so-nostalgic look back at some of the year‚Äôs fiercest fights. Arts & Leisure _____ Image Credit...Brett Gundlock for The New York Times We are having trouble retrieving the article content. Please enable JavaScript in your browser settings. Thank you for your patience while we verify access. If you are in Reader mode please exit and log into your Times account, or subscribe for all of The Times. Thank you for your patience while we verify access. Already a subscriber? Log in. Want all of The Times? Subscribe.",Arts,Not related to Blockchain
7,https://www.nytimes.com/2018/01/05/arts/comedy-in-nyc-this-week.html,Comedy in NYC This Week - The New York Times,2018-01-05T14:02:20.000Z,By Kasia Pilat,"Our guide to stand-up, improv and variety shows.","Our guide to stand-up, improv and variety shows. ‚Äò50 FIRST JOKES N.Y.C.‚Äô at the Bell House (Jan. 5, 8 p.m.). At this event, now in its 12th year, 50 comedians share the first joke they‚Äôve written since the start of 2018. The ebullient John F. O‚ÄôDonnell will serve as host for the night, with a diverse roster of comedians slated to perform, including Ike Ufomadu, Janelle James, Jo Firestone and many, many more. 718-643-6510, thebellhouseny.com YORAM BAUMAN, PH.D. at Caveat (Jan. 8, 7 p.m.). Billed as ‚Äúthe world‚Äôs first and only stand-up economist,‚Äù Mr. Bauman‚Äôs authority seems absolute: not only is he an author and educator, he also organizes the humor session at the annual meeting of the American Economic Association. With a take on comedy that deftly blends humor and academia, the audience is likely to learn as much as they laugh. 212-228-2100, caveat.nyc ‚ÄòFRANK CONNIFF‚ÄôS CARTOON DUMP‚Äô at Q.E.D. (Jan. 10, 7:30 p.m.). Patton Oswalt is said to have once referred to Frank Conniff‚Äôs variety and stand-up show as being ‚Äúlike a kids show done in Bosnia.‚Äù Fans of the show ‚ÄúMystery Science Theater 3000‚Äù will surely recognize Mr. Conniff, who hosts the event in character as Moodsy, the Clinically Depressed Owl. Styled as a kids‚Äô show, but likely not appropriate for actual children, vintage cartoons are interspersed between comedy and music. 347-451-3873, qedastoria.com ‚ÄòFUNNY AS TECH‚Äô at the People‚Äôs Improv Theater (Jan. 9, 7 p.m.). Those who like their comedy on the nerdy side will find just that in the blend of tech and jokes that this show and podcast provides. Cryptocurrency like bitcoin and the blockchain technology underlying it are the topic at hand for this installment, with guests including the bitcoin comedian and entrepreneur Margaux Avedisian; the author and a founder of Placeholder Ventures, Chris Burniske; and the creator of the first artist cryptocurrency, Tatiana Moroz. 212-563-7488, thepit-nyc.com ‚ÄòLAUGHTER IN THE CITY‚Äô at the Brooklyn Museum (Jan. 6, 8:30 p.m.). For its inaugural ‚ÄúFirst Saturday‚Äù event of the new year, the Brooklyn Museum hosts a comedy show featuring Jordan Carlos of ‚ÄúThe Nightly Show With Larry Wilmore‚Äù; the TED Fellow Negin Farsad; Ophira Eisenberg of NPR; and the ‚ÄúSaturday Night Live‚Äù writer Nimesh Patel. An open conversation, centered around humor and activism amid crisis, is to follow. 917-727-523, laughterinthecity.org ‚ÄòREPEATER‚Äô at Q.E.D. (Jan. 7, 8:30 p.m.). Once a month, the music fans Evan Forde Barden and Patrick Cartelli invite a guest to talk about one particular song they love and another guest to perform it. Josh Sharp, of ‚ÄúThe Opposition With Jordan Klepper,‚Äù picks the tune this time around, with Jacob Sharp of the band Mipso providing the musical component. 347-451-3873, qedastoria.com",Arts,Not related to Blockchain
8,https://www.nytimes.com/2018/02/03/arts/11-of-our-best-weekend-reads.html,11 of Our Best Weekend Reads - The New York Times,2018-02-03T10:03:29.000Z,By Kaly Soto,Our film critics have chosen 28 essential movies in honor of Black History Month. Cryptocurrency entrepreneurs are looking to create a haven in Puerto Rico. They were Super Bowl heroes; then they weren‚Äôt. And other great stories.,"Welcome to the weekend. Super Bowl Sunday is upon us. So get those wings ordered if you need to or get thee to a grocery store to grab ingredients for your favorite nachos (I am fond of these ‚Äúhighbrow‚Äù nachos, but I‚Äôve got friends in low places, too). If football is not your thing, and even if it is, here are some articles to exercise your brain. Read on! Image Credit...United Artists 28 days, 28 films for Black History Month Our chief film critics have chosen essential movies from the 20th century that convey the larger history of black Americans in cinema. Arts _____ Image Credit...Marcio Lima for The New York Times Most Afghans can‚Äôt read, but their book trade is booming Fueled by pent-up demand for both outside views and local authors, Kabul book publishers and sellers are flourishing ‚Äî and feeding a need for escape. International _____ Image Credit...Ezra Shaw/Getty Images We are having trouble retrieving the article content. Please enable JavaScript in your browser settings. Thank you for your patience while we verify access. If you are in Reader mode please exit and log into your Times account, or subscribe for all of The Times. Thank you for your patience while we verify access. Already a subscriber? Log in. Want all of The Times? Subscribe.",Arts,Not related to Blockchain
9,https://www.nytimes.com/2018/10/22/arts/design/christies-art-artificial-intelligence-obvious.html,Up for Bid  AI Art Signed ‚ÄòAlgorithm‚Äô - The New York Times,2018-10-22T17:55:48.000Z,By Gabe Cohn,"Preparing to test the art market ‚Äî and young buyers ‚Äî with ‚ÄúEdmond de Belamy, from La Famille de Belamy.‚Äù","With their eyes trained on a gilded frame containing a smeared, half-formed image of a distinguished gentleman, a small group of potential bidders gathered Friday night over cocktails at Christie‚Äôs New York and heard the pitch: here was the first portrait generated by an algorithm to come up for auction. The portrait, produced by artificial intelligence, hung on the wall opposite an Andy Warhol print and just to the right of a bronze work by Roy Lichtenstein. There were some smiles and at least one frown. Two people snapped cellphone pictures of the work, which looked as though someone had taken a sponge to a 17th-century oil portrait. The arrival of what some call the infant stages of the next great art movement at one of the world‚Äôs leading auction houses was greeted nonchalantly, with a nod of understanding and a sip of mezcal margarita. Christie‚Äôs is hoping for a more explosive reaction on Thursday, when the gavel comes down on ‚ÄúEdmond de Belamy, from La Famille de Belamy,‚Äù formally testing the art market‚Äôs interest in AI art. The work ‚Äî estimated at $7,000-$10,000 ‚Äî was a collaboration by the members of Obvious, a French trio composed of a student of machine learning and two business school graduates, none of whom have a background in art. There was no paint or brushes involved, just an algorithm that learns to imitate sets of images fed by humans ‚Äî in this case, thousands of portraits spanning the 14th century to the 20th. But is it art? Fr√©d√©rique Baumgartner, an art historian at Columbia University, said the AI work raised questions about ‚Äúintention and authorship,‚Äù but so, too, did artists from the past, including Marcel Duchamp (who famously made art out of a urinal). She went on to compare the portrait‚Äôs contrasting tones, coupled with the subject‚Äôs sober dress, with the old master of the Dutch Golden Age, Rembrandt van Rijn ‚Äî though she quickly added, ‚ÄúThat‚Äôs if I look half-closing my eyes.‚Äù Image Pierre Fautrel, one of the three members of the group Obvious that made the portrait using AI, in New York last week.Credit...Nathan Bajar for The New York Times The unusual sale shows the challenge traditional auction houses face staying relevant in a culture that moves at WiFi-enabled speeds. Christie‚Äôs ‚Äî which shattered auction-house records in 2017 when it sold a $450 million Leonardo da Vinci painting ‚Äî reached out directly to Obvious this year, rather than working through a seller. (It is the only AI work in Thursday‚Äôs sale of 363 lots.) We are having trouble retrieving the article content. Please enable JavaScript in your browser settings. Thank you for your patience while we verify access. If you are in Reader mode please exit and log into your Times account, or subscribe for all of The Times. Thank you for your patience while we verify access. Already a subscriber? Log in. Want all of The Times? Subscribe.",Arts,Not related to Blockchain
10,https://www.nytimes.com/2017/10/30/arts/design/japanese-art-on-its-own-terms.html,Japanese Art  on Its Own Terms - The New York Times,2017-10-30T06:00:29.000Z,By Sarah Moroz,An exhibition at the Pompidou Center in Metz shows that Japanese art is a lot more complicated than Westerners sometimes believe.,"METZ, France ‚Äî French and Japanese flags flap in tandem at the Pompidou Center here, hailing the fall program at this sister venue of the Paris museum of contemporary art. Its exhibitions include one about Japanese architecture from 1945 to the present day, and the recently opened ‚ÄúJapanorama,‚Äù a survey of Japan‚Äôs contemporary art since 1970, on view through March 5. ‚ÄúJapanorama‚Äù picks up where an important 1986 exhibition at the Pompidou Center in Paris, ‚ÄúAvant-Garde Arts of Japan 1910-1970,‚Äù left off. That show presented some important Japanese artists abroad for the first time ‚Äî but it examined their work as influenced by, and even dependent on, Western art traditions. Aomi Okabe, who was part of the 1986 show‚Äôs curatorial committee and is currently artistic director of exhibitions at the Japanese Culture House of Paris, said that, at the time, ‚Äúthe French public considered modern Japanese paintings of the early 20th century copies of European art, especially from France.‚Äù Image The Pompidou Center in Metz is holding two Japan-themed exhibitions in its fall program.Credit...Dmitry Kostyukov for The New York Times The subtitle of ‚ÄúJapanorama‚Äù is ‚ÄúNew Vision on Art Since 1970,‚Äù the year that Japan began to reassert its own cultural identity, spurred by the new confidence it found at Expo ‚Äô70 in Osaka. The show is a ‚Äúdiscovery of what was overlooked,‚Äù the curator, Yuko Hasegawa, said. While Japan wrestled with complicated issues of modernization and heritage, its culture was understood in the West though clich√©d binaries: The ascetic Zen of a rock garden on one hand, the gleeful kitsch of Hello Kitty on the other. The exhibition corrects this reductive caricature, examining the way the push and pull between tradition and technology, individual and collective, have shaped the culture in unique ways. For European audiences, what‚Äôs new about this ‚ÄúNew Vision‚Äù is examining contemporary Japanese art on its own terms. European interest in Japanese art dates back to the 19th century ‚Äî van Gogh collected Ukiyo-e prints, Monet modeled his water lily pond at Giverny on Japanese gardens ‚Äî yet many of today‚Äôs art institutions rarely showcase non-Western contemporary art. There have been piecemeal exhibitions in Paris over the past year, among them shows at the Palais de Tokyo, Le Bal, Fondation Cartier and the European House of Photography. But no exhibition here in France has examined Japanese creativity across eras, mediums and generations. We are having trouble retrieving the article content. Please enable JavaScript in your browser settings. Thank you for your patience while we verify access. If you are in Reader mode please exit and log into your Times account, or subscribe for all of The Times. Thank you for your patience while we verify access. Already a subscriber? Log in. Want all of The Times? Subscribe.",Arts,Not related to Blockchain
1, https://news.blogs.nytimes.com/2016/07/13/morning-agenda-lawyers-in-line-of-fire-at-delaware-courts/,Morning Agenda: Lawyers in Line of Fire at Delaware Courts - The New York Times,,Amie Tsang,A Founder of Hyperloop One Claims Harassment in Lawsuit | Blythe Masters Steps Down as Chairwoman of Santander Consumer USA,Content not found,,Not related to Blockchain
2, https://news.blogs.nytimes.com/2016/06/17/morning-agenda-a-whos-who-of-financiers-expected-at-trump-fund-raiser/,Morning Agenda: A Who's Who of Financiers Expected at Trump Fund-Raiser - The New York Times,2016-06-17T:00,Amie Tsang,Viacom Battle Escalates Again | Microsoft Moves Into the Marijuana Business,"A WHOíS WHO OF FINANCIERS EXPECTED AT TRUMP FUND-RAISER Donald J. Trump is holding a fund-raiser with the Republican National Committee on Tuesday in New York City, Alexandra Stevenson reports in DealBook The event will be hosted by a whoís who of the financial world, including John A. Paulson, whose hedge fund made billions betting on the collapse of the housing market. He will be joined by Stephen A. Feinberg, the founder of Cerberus Capital Management, and Peter Kalikow, the real estate magnate. Tickets were going for $50,000 a person, although the hosts are paying $250,000 a couple. An invitation seen by The New York Times said that additional details would be disclosed once a reservation had been made. The attendance of these men, some of whom had not publicly declared their support for the presumptive party nominee, indicate that a small, but growing crowd in the financial sphere is warming up to the idea of backing Mr. Trump. This is crucial for the presidential candidate as Hillary Clintonís donor network includes the billionaire George Soros and she has the backing of some well-known Wall Street executives. Other hosts include Wilbur L. Ross, a distressed debt specialist, and Anthony Scaramucci, a hedge fund executive. Mr. Scaramucci said on Thursday that he expected about 50 or 60 people to attend the dinner, which is expected to be held at someoneís home, although the Secret Service will not disclose the location until the day before the event. Mr. Scaramucci was among the first on Wall Street to publicly announce his support for Mr. Trump and has been instrumental in introducing Mr. Trump to the hedge fund and private equity world. But other executives have been more wary of supporting Mr. Trump, who has spoken out against the hedge fund industry and the generous compensation packages hedge funds give themselves. Mr. Trump also said he planned to end carried interest, which allows private equity and hedge fund executives to pay lower taxes by treating their income as capital gains, which are taxed at a lower rate.",,Related to Blockchain
